title,abstract,track,date,time,format,theme,status,confirmed,featured,audience,name,organization,role,image,headshot,twitter,github,website
"Simple caching, made difficult.","Let's dive into the journey towards successfully synchronizing the TTL of your data with the cache expiration in a GraphQL request.
",Bayview,10/30/2019 2:00 PM,2:00 PM,Lightning Talk (10 min),GraphQL infrastructure,Accepted,Y,,Intermediate,Eric Baer,Livestock Nutrition Center,Director Of Engineering,,https://drive.google.com/open?id=1uOP_Mz49EzW1DSWhZvIcnRzoT3ku9onX,https://twitter.com/ebaerbaerbaer,https://github.com/baer,https://www.ericbaer.com/
Adding Typescript to your GraphQL server,"Considering moving your existing GraphQL server to Typescript, but don’t know where to start? This talk will walk you through all the basics: from adding Typescript to your server, convincing your team and the migration strategy that will eventually get you there.",Bayview,10/30/2019 2:15 PM,2:15 PM,Lightning Talk (10 min),Deep dive (Server),Accepted,Y,,Intermediate,Zhifan Li,Intuit,Software Engineer,,https://drive.google.com/open?id=1dwxO4CtMeC_6Jd6DC2b02P7zCTOJ1ko-,http://twitter.com/iszfan,https://github.com/iszfan,http://iszfan.github.io/
How do you get changes made to GraphQL?,"In this talk, you'll learn how to pitch for a change to the GraphQL specs, or first-party projects.",General Session,10/31/2019 11:00 AM,11:00 AM,Session (25 min),Community,Accepted,Y,,Intermediate,Orta,Microsoft,Engineer On Typescript,,https://drive.google.com/open?id=1-5Wb0fum8T_cnE7aLQNA8h0xUsW_j0JV,https://twitter.com/orta,https://github.com/orta,https://orta.io
What About the Database? How to Write Efficient Queries for GraphQL Resolvers,"When writing GraphQL servers, we often place a lot of emphasis on how to craft good resolvers. However, we don't often think about how to create good database queries to furnish the data for those resolvers. Let's look at how it's easy to fall into the trap of writing inefficient database queries and how we can use GraphQL itself to solve this problem.",Bayview,10/31/2019 11:30 AM,11:30 AM,Session (25 min),Deep dive (Server),Accepted,Y,,Intermediate,Ryan Chenkie,Elevate Digital Inc,"Owner, Developer",,https://drive.google.com/open?id=18mGXJ6ktUkWOVshtd9qhqitU4J-Nz3D5,https://twitter.com/ryanchenkie,https://github.com/chenkie,https://ryanchenkie.cm
I heart GraphQL (and Kotlin),"In this talk, you'll hear from a Kotlin fanboy who wants to show you how he built his GraphQL APIs.",Bayview,10/31/2019 9:30 AM,9:30 AM,Session (25 min),Deep dive (Server),Accepted,Y,,Intermediate,Rohit Basu,PayPal,Architect,,https://drive.google.com/open?id=1ITXZFhxvl9kpWCp8gI-11WPiomg1wkn7,https://twitter.com/rohitdbasu?lang=en,,
LinkedIn's Economic Graph on GraphQL,"LinkedIn is leveraging GraphQL to enable easier addition and access of entities in the Economic Graph for first party products. The talk will present LinkedIn’s vision for modelling entities (like member, activity, company etc.), defining privacy rules and enabling a consistent access experience across online, nearline and offline environments.",Seacliff,10/31/2019 2:00 PM,2:00 PM,Session (25 min),Deep dive (Server),Accepted,Y,,Intermediate,Gopal Holla,LinkedIn Corporation,Staff Software Engineer,,https://drive.google.com/open?id=1kFW90Iva-hnXtywfB8_fqTDB5xaONOng,,https://github.com/vgkholla,
Transforming customer experiences and your organization with GraphQL,"Through storytelling, Dan Boerner and Jim Gust will share the expected and unexpected ways that GraphQL is transforming how Expedia Group creates seamless customer experiences across their front-end platforms. Along the way, they will share hard fought lessons and mistakes during their journey selling the promise of GraphQL, keeping momentum building beyond the initial POC team, and scaling a graph that spans the many services and teams.",General Session,10/30/2019 2:30 PM,2:30 PM,Session (25 min),Scaling your business,Accepted,Y,,Beginner,Dan Boerner,Expedia ,Distinguished Product Manager,https://i.imgur.com/1q0TeOs.jpg,,,,
The GraphQL developer experience,Hear about how the shift from legacy APIs to GraphQL can spark joy and productivity in developers. See Danielle walk through a live demo of connecting backend services to UI with a seamless programming model that extends from server to client using Apollo GraphQL and React,General Session,10/30/2019 11:00 AM,11:00 AM,Session (25 min),The GraphQL stack,Accepted,Y,,Intermediate,Danielle Man,Apollo,Engineering Manager,https://i.imgur.com/ompnQ6J.jpg,,,,
The agile schema evolution and graph management,"As GraphQL usage increases in an organization, Evans will demonstrate why it’s important for teams to practice agile schema development and iteratively evolve their schema over time",Seacliff,10/31/2019 10:00 AM,10:00 AM,Session (25 min),Deep dive (Server),Accepted,Y,,Intermediate,Evans Hauser,Apollo,Core Developer,https://i.imgur.com/ygJY2YZ.jpg,,,,
Digging into the Apollo iOS SDK,"Learn about the what and why of recent updates to ApolloGraphQL’s Swift iOS SDK, including integrating with Swift Package Manager, and get a preview of our updated code generation process.",General Session,10/31/2019 10:00 AM,10:00 AM,Session (25 min),Deep dive (Client),Accepted,Y,,Intermediate,Ellen Shapiro,Apollo,Mobile Engineer,https://i.imgur.com/KXoFQVw.jpg,,,,
Migrating Apollo’s Data Graph from Schema-stitching to Federation,"Find out more about the infrastructure that powers Apollo Graph Manager and how we have evolved the Graph Manager Data Graph (ooh, that’s meta) from monolith to schema-stitching to federation. Learn from the mistakes we made, the patterns that ultimately worked, and the way we took advantage of federation to enhance both our product delivery process and graph performance",Seacliff,10/31/2019 12:00 PM,12:00 PM,Session (25 min),GraphQL infrastructure,Accepted,Y,,Intermediate,Adam Zionts,Apollo,Engineering Manager,https://i.imgur.com/ewqh3Kf.jpg,,,,
Fine-Tuning Apollo Client Caching for Your Data Graph,"While cache normalization is essential for reactive updates in a single-page application, and Apollo Client provides powerful default normalization behavior, not all parts of all applications need to remain up-to-date at all times, and common patterns like pagination can benefit from custom normalization implementations. Learn how to customize the Apollo Client cache to suit your weirdest data modeling and reactivity needs, using the all-new cache API in Apollo Client 3.0.",General Session,10/30/2019 12:00 PM,12:00 PM,Session (25 min),The GraphQL stack,Accepted,Y,,Intermediate,Ben Newman,Apollo,Apollo Client Architect,https://i.imgur.com/kFO9DW6.jpg,,,,
The Architecture of Federation,"Apollo Federation brought a new architecture to GraphQL and a new way of thinking about how to design and build a schema, but what does it mean for how your team builds a data graph? In this talk you will learn about the architectural principles behind federation and see how you can implement a well designed and structured data graph using Apollo.",General Session,10/30/2019 3:00 PM,3:00 PM,Session (25 min),Deep dive (Server),Accepted,Y,,Intermediate,Jeff Hampton,Apollo,,https://i.imgur.com/YYcPrI3.jpg,,,,
Protecting your GraphQL server in production using best practices and tooling in the Apollo GraphQL Platform,"Come learn best practices for protecting your GraphQL server in production from bad actors and shipping breaking changes. We’ll start with the basics and then show how we can use the Apollo GraphQL Platform to prevent shipping breaking schema changes that could bring down your graph; even for a federated graph! Then we’ll look at how we can create an operation safelist for your graph using the Apollo CLI and Apollo Operation Registry. This talk will primarily cover Apollo Server use cases, but some of the basics will apply to any GraphQL server.",Seacliff,10/30/2019 4:30 PM,4:30 PM,Session (25 min),Deep dive (Server),Accepted,Y,,Intermediate,Michael Watson,Apollo,Customer Success Engineer,https://i.imgur.com/EgWmdx9.jpg,,,,